{
  "schema_version": 1,
  "name": "Syncify",
  "root_identity": "a1b2c3d4e5f60718293a4b5c6d7e8f90123456789abcdef0123456789abcdef0",
  "base_revision": "rev-syncify-fixture-001",
  "inventory": {
    "total_files": 120,
    "total_bytes": 450000,
    "languages": [
      "rust",
      "typescript",
      "python"
    ],
    "areas": [
      {
        "name": "src-tauri",
        "path": "src-tauri/",
        "file_count": 45,
        "description": "Rust backend"
      },
      {
        "name": "ui",
        "path": "ui/",
        "file_count": 65,
        "description": "TypeScript UI"
      },
      {
        "name": "scripts",
        "path": "scripts/",
        "file_count": 10,
        "description": "Bridge scripts"
      }
    ]
  },
  "authority": {
    "holder": "user",
    "source": "fixture-declared"
  }
}
